{
  "research_questions": [
    "CANDIDATE SCOPE: the surveyed set is DBML, Mermaid erDiagram (incumbent baseline), LinkML, PlantUML IE/Chen notation, Prisma schema language, Atlas HCL (ariga.io), and D2 with SQL table shapes. tbls, SchemaSpy, and ERAlchemy2 were dropped from the seed list at planning time, all for the same reason: each is a reverse-engineering documentation generator whose authoritative source is a live database connection, a JDBC introspection target, or SQLAlchemy runtime metadata, not a plain-text, human-authored, version-controlled model. This inverts the direction the brief requires (the specification artifact must be authoritative), the same exclusion the brief already applies to code-first ORMs. If source-gathering later finds a plain-text, spec-first authoring mode for any of the three (e.g. tbls consuming a hand-written schema file rather than a live DB), the assignee for that candidate must record it as new evidence and the drop must be revisited, not silently upheld.",
    "For each surveyed candidate: can it express a composite primary key spanning two non-surrogate columns, as OUTCOME_RULE needs on (task_version_id, sequence_no), NAMED_RESOURCE_LINK needs on (task_version_id, resource_name), and CONDITION_POST needs on (condition_id, date_key)? Answer expressible / expressible-only-via-workaround / not-expressible, citing the exact grammar rule or documentation section.",
    "For each surveyed candidate: can it express an opaque JSON payload column, as TASK_VERSION needs for schedule_spec, window_spec, dependency_spec, output_condition_spec, retry_spec, and cyclic_spec? Answer with the same three-way classification and citation.",
    "For each surveyed candidate: can it express an enumerated string domain constrained to a fixed value set, as FOLDER_RUN.execution_context needs (SCHEDULED or MANUAL) and NAMED_RESOURCE_LINK.link_kind needs (HOST_CAPACITY or NAMED_RESOURCE)? Answer with the same three-way classification and citation.",
    "For each surveyed candidate: can it express several distinct self-referencing foreign keys on one table, as TASK_INSTANCE needs for origin_instance_id, cyclic_root_instance_id, and previous_iteration_id simultaneously? Answer with the same three-way classification and citation.",
    "For each surveyed candidate: can it express a nullable foreign key, as TASK_INSTANCE.folder_run_id and TASK_INSTANCE.plan_id both need? Answer with the same three-way classification and citation.",
    "For each surveyed candidate: can it express a multi-column UNIQUE constraint not tied to the primary key, as PLAN needs on (domain_id, odate) and NAMED_RESOURCE needs on (domain_id, name)? Answer with the same three-way classification and citation.",
    "For each surveyed candidate: can it express a one-to-zero-or-one relationship, as ATTEMPT ||--o| ATTEMPT_RESULT needs? Answer with the same three-way classification and citation.",
    "For each surveyed candidate: can it express a value constraint beyond type, as NAMED_RESOURCE_LINK.resource_task_weight needs (a decimal positive integer OR the literal ALL)? Answer with the same three-way classification and citation.",
    "For each surveyed candidate: can it express several logical schemas inside one database, matching the configuration, runtime, audit, and resources split described in docs/adr/0001-single-database-domain-scoping.md and docs/arc42/00-system-map.md line 121? Answer with the same three-way classification and citation.",
    "For each surveyed candidate: does its validator (or an available lint/generation step) support asserting a cross-cutting convention such as domain_id present on every Domain-owned table? Answer with the same three-way classification and citation, distinguishing a built-in rule from a workaround (e.g. a custom lint script layered on top).",
    "For each surveyed candidate: does a validator exist, and does it exit non-zero on a malformed or internally inconsistent model, so the artifact could sit behind a deterministic CI gate the way factory/scripts/structurizr's validate subcommand does for architecture? Cite the exact command and observed (or documented) exit-code contract.",
    "For each surveyed candidate: is a Docker image published, and under what exact image name and tag, verified against the public registry listing (Docker Hub or ghcr.io tag list) rather than a README or blog claim? Record the registry URL consulted and the tag observed.",
    "For each surveyed candidate: does the toolchain export SVG from inside that Docker image with no local install, matching factory/scripts/structurizr's export-svg subcommand?",
    "For each surveyed candidate: does the toolchain export PNG from inside that Docker image with no local install, matching factory/scripts/structurizr's export-png subcommand?",
    "For each surveyed candidate: does it support named subset views over one model, so a 25-entity model can be split into readable sub-diagrams the way Structurizr's views do for architecture? Cite the exact mechanism, or record its absence.",
    "For each surveyed candidate: can it generate application-level types (Pydantic models, SQLAlchemy mappings, dataclasses, or equivalent), and if so, do the advanced constructs above (composite PKs, JSON columns, enums, multiple self-referencing FKs, nullable FKs, multi-column UNIQUE, one-to-zero-or-one, the ALL-or-integer value constraint) survive that generation intact or degrade/drop? Record per-construct survival, not just yes/no for generation existing.",
    "For each surveyed candidate that generates application types: can physical DDL also be derived from the same source artifact, and does that DDL preserve the advanced constructs? If no type generation exists, record DDL derivation as not applicable rather than not expressible.",
    "For each surveyed candidate: what is its licence (exact SPDX identifier or licence name and version), and what is its governance model (single-vendor, foundation-governed, BDFL, community/consensus), sourced from the repository's LICENSE file and governance or CONTRIBUTING documentation?",
    "For each surveyed candidate: what is the date of the most recent tagged release and the date of the most recent repository activity (commit, merge, or release), and does either fall within the 18 months before August 2026 (i.e. since roughly February 2025)? Flag any candidate failing both as at risk of abandonment per the brief's freshness_requirements.",
    "For each surveyed candidate: what does a documented contrary-evidence search turn up — open issues describing missing features among the advanced constructs above, a documented limitations page, or explicit 'not supported' statements in official docs? Record search terms, where searched, and the result even when nothing was found."
  ],
  "search_angles": [
    "Official grammar or language specification published by the candidate's maintaining org or project (e.g. a formal grammar file, an EBNF definition, or a 'language reference' documentation page) — the primary source for every expressible/not-expressible citation.",
    "Official documentation site (docs.<project>.io, readthedocs, or the project's own docs/ directory rendered as a site) for validator behaviour, view/subset support, generation targets, and DDL derivation.",
    "The project's own GitHub (or equivalent) repository: README, docs/ folder, CONTRIBUTING.md or GOVERNANCE.md, LICENSE file.",
    "The project's release tags page (GitHub Releases or equivalent) for version history and the most recent release date.",
    "The project's issue tracker, searched for open issues naming the advanced constructs (composite key, JSON column, enum, self-referencing FK, nullable FK, multi-column unique, one-to-zero-or-one, custom value constraint, multiple schemas, cross-cutting column lint) to find both confirmations and known gaps.",
    "The public container registry tag listing (hub.docker.com/r/<image> or ghcr.io/<org>/<image>/tags) for image availability and exact tags — never a README or blog claim standing in for this check.",
    "The repository's LICENSE file directly, for the licence source_targets item, rather than a third-party licence-summary site.",
    "Governance or maintainer documentation (GOVERNANCE.md, MAINTAINERS.md, an 'About' or 'Team' page, or a foundation charter if the project sits under one such as a Linux Foundation or similar body).",
    "CONTRARY-EVIDENCE ANGLE (mandatory per the evidence policy's contrary-evidence-search requirement): search the project's issue tracker and docs for limitations pages, 'known issues', 'not supported', or 'unsupported' statements touching the advanced constructs, validator exit-code behaviour, Docker packaging, view/subset support, or generation fidelity. Record the search even when it finds nothing."
  ],
  "source_targets": [
    "PRIMARY: the official language grammar or specification document maintained by the candidate's own project or org — required for every 'expressible' citation.",
    "PRIMARY: the official documentation site or in-repo docs/ maintained by the candidate's own project — required for validator, view, generation, and DDL-derivation claims.",
    "PRIMARY: the candidate's own source-code repository, including its release tags list and issue tracker.",
    "PRIMARY: the public container registry's own tag-listing page (Docker Hub or ghcr.io) — required for any Docker-availability claim; a blog post or README asserting 'available on Docker Hub' is not sufficient on its own.",
    "PRIMARY: the repository's LICENSE file, read directly, for the licence field.",
    "PRIMARY: the repository's governance/maintainer documentation (GOVERNANCE.md, MAINTAINERS.md) or, absent that, the visible maintainer/organisation structure on the repository itself, for the governance field.",